"2","1","Data Analyst","Join our data team and help us analyze and visualize key business metrics. We are seeking someone with a strong background in data analysis and statistical modeling.","45,000 - 65,000","San Francisco, CA","Data Solutions","https://www.datasolutions.com","Full-time","Data Science","2",,"2025-01-02 00:00:00","2025-03-01 00:00:00","Active"
"3","1","Graphic Designer","We are seeking a creative and talented graphic designer to help create visual content for our marketing team. Strong skills in Adobe Creative Suite required.","40,000 - 55,000","Los Angeles, CA","Creative Studio","https://www.creativestudio.com","Full-time","Design","1",,"2025-01-03 00:00:00","2025-04-01 00:00:00","Active"
"4","1","Project Manager","We are looking for an experienced project manager to oversee our ongoing software development projects. The candidate should have experience managing a team and meeting deadlines.","60,000 - 85,000","Chicago, IL","Global Projects Inc.","https://www.globalprojects.com","Full-time","Management","5",,"2025-01-04 00:00:00","2025-02-28 00:00:00","Active"
"5","1","Marketing Specialist","Looking for a marketing specialist to help develop and implement strategies to promote our products and services. Experience with digital marketing and SEO is a must.","40,000 - 60,000","Boston, MA","MarketX","https://www.marketx.com","Full-time","Marketing","2",,"2025-01-05 00:00:00","2025-03-01 00:00:00","Active"
"6","1","Java Developer","Who has good hands on experience in Java programming can apply for this position.","600000","Bengaluru","ABD TECH","www.abdtech.in","Full-time","Engineering","0",,"2025-01-02 19:24:41","2025-01-10 00:00:00","Active"
"7","1","Java Developer","Who has good hands on experience in Java programming can apply for this position.","600000","Bengaluru","ABD TECH","www.abdtech.in","Full-time","Engineering","0",,"2025-01-02 19:28:08","2025-01-09 00:00:00","Active"
"8","1","Java Back-End Developer","Who has good hands on experience in Java programming can apply for this position.","600000-700000","Bengaluru","ABD TECH","www.abdtech.in","Full-time","Engineering","0",,"2025-01-03 10:00:46","2025-01-10 00:00:00","Active"
"12","2","MERN Stack Developer ","Who has good hands on experience in MERN can apply for this position.","60000 - 70000","Hyderabad 2","VIBHO TECH","www.vibhotech.in","Full-time","Design","0",,"2025-01-03 15:56:50","2025-01-06 00:00:00","Active"
"13","2","MERN Stack Developer ","Who has good hands on experience in Java programming can apply for this position.","60000 - 70000","Hyderabad","ABD TECH","www.vibhotech.in","Full-time","Engineering","0",,"2025-01-03 16:05:32","2025-01-23 00:00:00","Active"
